{
  "category_counts": {
    "benign_counterfactual": 10,
    "entity_integrity": 8,
    "hostile_privacy": 3,
    "mutation_metamorphic": 3,
    "scale_resource": 4,
    "schema_surface": 4,
    "temporal_data_quality": 8,
    "true_positive": 8
  },
  "hunt_id": "H02",
  "scenario_count": 48,
  "scenarios": [
    {
      "applicable_surfaces": [
        "sentinel_analytics"
      ],
      "category": "true_positive",
      "expected_entities": [
        "account",
        "session",
        "cloud_resource"
      ],
      "expected_matches": 1,
      "expected_qualification_outcome": "match",
      "expected_relationships": [
        "Join1",
        "Join2"
      ],
      "expected_stage_counts": {
        "S01": 1,
        "S02": 1,
        "S03": 1
      },
      "id": "H02-true_positive-01",
      "input": {
        "controls": {
          "positive_variant": 1
        },
        "correlation_window": "2h",
        "events": [
          {
            "entity_id": "entity-h02-01-s1",
            "event_id": "h02-01-s1",
            "event_time": "2026-01-03T00:02:00Z",
            "join_out": "link-h02-01-1",
            "stage": "S01",
            "tenant_id": "00000000-0000-4000-8000-000000000001",
            "workspace_id": "00000000-0000-4000-8000-000000000002"
          },
          {
            "entity_id": "entity-h02-01-s2",
            "event_id": "h02-01-s2",
            "event_time": "2026-01-03T00:03:00Z",
            "join_in": "link-h02-01-1",
            "join_out": "link-h02-01-2",
            "stage": "S02",
            "tenant_id": "00000000-0000-4000-8000-000000000001",
            "workspace_id": "00000000-0000-4000-8000-000000000002"
          },
          {
            "entity_id": "entity-h02-01-s3",
            "event_id": "h02-01-s3",
            "event_time": "2026-01-03T00:04:00Z",
            "join_in": "link-h02-01-2",
            "stage": "S03",
            "tenant_id": "00000000-0000-4000-8000-000000000001",
            "workspace_id": "00000000-0000-4000-8000-000000000002"
          }
        ]
      },
      "prohibited_conclusions": [
        "confirmed compromise",
        "causal attribution",
        "operational efficacy"
      ],
      "purpose": "ordered synthetic evidence satisfies every required hop",
      "rationale": "Hand-authored true_positive contract variant 1; values are synthetic and reserved for documentation."
    },
    {
      "applicable_surfaces": [
        "sentinel_analytics"
      ],
      "category": "true_positive",
      "expected_entities": [
        "account",
        "session",
        "cloud_resource"
      ],
      "expected_matches": 1,
      "expected_qualification_outcome": "match",
      "expected_relationships": [
        "Join1",
        "Join2"
      ],
      "expected_stage_counts": {
        "S01": 1,
        "S02": 1,
        "S03": 1
      },
      "id": "H02-true_positive-02",
      "input": {
        "controls": {
          "positive_variant": 2
        },
        "correlation_window": "2h",
        "events": [
          {
            "entity_id": "entity-h02-02-s1",
            "event_id": "h02-02-s1",
            "event_time": "2026-01-03T00:03:00Z",
            "join_out": "link-h02-02-1",
            "stage": "S01",
            "tenant_id": "00000000-0000-4000-8000-000000000001",
            "workspace_id": "00000000-0000-4000-8000-000000000002"
          },
          {
            "entity_id": "entity-h02-02-s2",
            "event_id": "h02-02-s2",
            "event_time": "2026-01-03T00:04:00Z",
            "join_in": "link-h02-02-1",
            "join_out": "link-h02-02-2",
            "stage": "S02",
            "tenant_id": "00000000-0000-4000-8000-000000000001",
            "workspace_id": "00000000-0000-4000-8000-000000000002"
          },
          {
            "entity_id": "entity-h02-02-s3",
            "event_id": "h02-02-s3",
            "event_time": "2026-01-03T00:05:00Z",
            "join_in": "link-h02-02-2",
            "stage": "S03",
            "tenant_id": "00000000-0000-4000-8000-000000000001",
            "workspace_id": "00000000-0000-4000-8000-000000000002"
          }
        ]
      },
      "prohibited_conclusions": [
        "confirmed compromise",
        "causal attribution",
        "operational efficacy"
      ],
      "purpose": "ordered synthetic evidence satisfies every required hop",
      "rationale": "Hand-authored true_positive contract variant 2; values are synthetic and reserved for documentation."
    },
    {
      "applicable_surfaces": [
        "sentinel_analytics"
      ],
      "category": "true_positive",
      "expected_entities": [
        "account",
        "session",
        "cloud_resource"
      ],
      "expected_matches": 1,
      "expected_qualification_outcome": "match",
      "expected_relationships": [
        "Join1",
        "Join2"
      ],
      "expected_stage_counts": {
        "S01": 1,
        "S02": 1,
        "S03": 1
      },
      "id": "H02-true_positive-03",
      "input": {
        "controls": {
          "positive_variant": 3
        },
        "correlation_window": "2h",
        "events": [
          {
            "entity_id": "entity-h02-03-s1",
            "event_id": "h02-03-s1",
            "event_time": "2026-01-03T00:04:00Z",
            "join_out": "link-h02-03-1",
            "stage": "S01",
            "tenant_id": "00000000-0000-4000-8000-000000000001",
            "workspace_id": "00000000-0000-4000-8000-000000000002"
          },
          {
            "entity_id": "entity-h02-03-s2",
            "event_id": "h02-03-s2",
            "event_time": "2026-01-03T00:05:00Z",
            "join_in": "link-h02-03-1",
            "join_out": "link-h02-03-2",
            "stage": "S02",
            "tenant_id": "00000000-0000-4000-8000-000000000001",
            "workspace_id": "00000000-0000-4000-8000-000000000002"
          },
          {
            "entity_id": "entity-h02-03-s3",
            "event_id": "h02-03-s3",
            "event_time": "2026-01-03T00:06:00Z",
            "join_in": "link-h02-03-2",
            "stage": "S03",
            "tenant_id": "00000000-0000-4000-8000-000000000001",
            "workspace_id": "00000000-0000-4000-8000-000000000002"
          }
        ]
      },
      "prohibited_conclusions": [
        "confirmed compromise",
        "causal attribution",
        "operational efficacy"
      ],
      "purpose": "ordered synthetic evidence satisfies every required hop",
      "rationale": "Hand-authored true_positive contract variant 3; values are synthetic and reserved for documentation."
    },
    {
      "applicable_surfaces": [
        "sentinel_analytics"
      ],
      "category": "true_positive",
      "expected_entities": [
        "account",
        "session",
        "cloud_resource"
      ],
      "expected_matches": 1,
      "expected_qualification_outcome": "match",
      "expected_relationships": [
        "Join1",
        "Join2"
      ],
      "expected_stage_counts": {
        "S01": 1,
        "S02": 1,
        "S03": 1
      },
      "id": "H02-true_positive-04",
      "input": {
        "controls": {
          "positive_variant": 4
        },
        "correlation_window": "2h",
        "events": [
          {
            "entity_id": "entity-h02-04-s1",
            "event_id": "h02-04-s1",
            "event_time": "2026-01-03T00:05:00Z",
            "join_out": "link-h02-04-1",
            "stage": "S01",
            "tenant_id": "00000000-0000-4000-8000-000000000001",
            "workspace_id": "00000000-0000-4000-8000-000000000002"
          },
          {
            "entity_id": "entity-h02-04-s2",
            "event_id": "h02-04-s2",
            "event_time": "2026-01-03T00:06:00Z",
            "join_in": "link-h02-04-1",
            "join_out": "link-h02-04-2",
            "stage": "S02",
            "tenant_id": "00000000-0000-4000-8000-000000000001",
            "workspace_id": "00000000-0000-4000-8000-000000000002"
          },
          {
            "entity_id": "entity-h02-04-s3",
            "event_id": "h02-04-s3",
            "event_time": "2026-01-03T00:07:00Z",
            "join_in": "link-h02-04-2",
            "stage": "S03",
            "tenant_id": "00000000-0000-4000-8000-000000000001",
            "workspace_id": "00000000-0000-4000-8000-000000000002"
          }
        ]
      },
      "prohibited_conclusions": [
        "confirmed compromise",
        "causal attribution",
        "operational efficacy"
      ],
      "purpose": "ordered synthetic evidence satisfies every required hop",
      "rationale": "Hand-authored true_positive contract variant 4; values are synthetic and reserved for documentation."
    },
    {
      "applicable_surfaces": [
        "sentinel_analytics"
      ],
      "category": "true_positive",
      "expected_entities": [
        "account",
        "session",
        "cloud_resource"
      ],
      "expected_matches": 1,
      "expected_qualification_outcome": "match",
      "expected_relationships": [
        "Join1",
        "Join2"
      ],
      "expected_stage_counts": {
        "S01": 1,
        "S02": 1,
        "S03": 1
      },
      "id": "H02-true_positive-05",
      "input": {
        "controls": {
          "positive_variant": 5
        },
        "correlation_window": "2h",
        "events": [
          {
            "entity_id": "entity-h02-05-s1",
            "event_id": "h02-05-s1",
            "event_time": "2026-01-03T00:06:00Z",
            "join_out": "link-h02-05-1",
            "stage": "S01",
            "tenant_id": "00000000-0000-4000-8000-000000000001",
            "workspace_id": "00000000-0000-4000-8000-000000000002"
          },
          {
            "entity_id": "entity-h02-05-s2",
            "event_id": "h02-05-s2",
            "event_time": "2026-01-03T00:07:00Z",
            "join_in": "link-h02-05-1",
            "join_out": "link-h02-05-2",
            "stage": "S02",